{
  "response_id": "123e4567-e89b-42d3-a456-426614174000",
  "survey_version": "1.0.0",
  "contract_version": "2.0.0",
  "source": "survey_web_form",
  "locale": "en",
  "submitted_at": "2026-08-22T12:00:00.000Z",
  "answers": {
    "residence_region_id": "eu",
    "centre_ids": ["munich"],
    "other_centre_text": null,
    "service_id": "id_card",
    "other_service_text": null,
    "slot_search_experience": "not_started",
    "check_frequency": "not_checking_yet",
    "search_duration": null,
    "appointment_urgency": null,
    "problem_category_ids": ["none"],
    "other_problem_text": null,
    "cross_border_flexibility": null,
    "notification_channel_ids": ["none"],
    "other_notification_channel_text": null,
    "primary_notification_channel_id": "none",
    "manual_captcha_attitude": "not_sure",
    "early_testing_interest": "maybe",
    "additional_context": null
  },
  "consent": { "research": true }
}
